text,text,label,target
"<s><|user|>Reduce Narrative (sentiment, pacing, plotting): Sara's heart raced as she arrived at the airport, scanning the bustling crowd for a familiar face. Just as worry began to gnaw at her, she felt a tap on her shoulder. Turning around, tears welled up as she saw her best friend standing there, a wide smile breaking across her face.</s>","<|assistant|>Reduced Narrative: Neutral, Fast, Conflict Resolving</s>","<|assistant|>Reduced Narrative: Neutral, Fast, Conflict Resolving</s>","<|assistant|>Reduced Narrative: Neutral, Fast, Conflict Resolving</s>"
"<s><|user|>Reduce Narrative (sentiment, pacing, plotting): As the storm clouds gathered overhead, tensions heightened among the group. Sarah's gaze darted between her companions, noting the frowns and the clenched fists. Thunder rumbled ominously in the distance, mirroring the turbulent emotions swirling within the small circle.</s>","<|assistant|>Reduced Narrative: Negative, Fast, Conflict Rising</s>","<|assistant|>Reduced Narrative: Negative, Fast, Conflict Rising</s>","<|assistant|>Reduced Narrative: Negative, Fast, Conflict Rising</s>"
"<s><|user|>Reduce Narrative (sentiment, pacing, plotting): The crisp autumn air brushed against her cheeks as Emma hurried down the narrow cobblestone path. She clutched a letter in her hand, the words scrawled by her estranged father haunting her thoughts. With each step, her heart raced faster, uncertainty mingling with a flicker of hope in her chest. Emma knew that confronting her past could either shatter her fragile world or offer a chance at healing, but the only way forward was through these hidden cobblestone streets leading to her father's door.</s>","<|assistant|>Reduced Narrative: Neutral, Fast, Conflict Rising</s>","<|assistant|>Reduced Narrative: Neutral, Fast, Conflict Rising</s>","<|assistant|>Reduced Narrative: Neutral, Fast, Conflict Rising</s>"
"<s><|user|>Reduce Narrative (sentiment, pacing, plotting): The wind howled through the dark forest, sending shivers down Lucy's spine as she tried to find her way back to the campsite. Every step seemed to lead her deeper into the maze of trees, branches clawing at her clothes. Panic gripped her heart as she realized she was lost, with the sun dipping below the horizon.</s>","<|assistant|>Reduced Narrative: Negative, Moderate, Conflict Rising</s>","<|assistant|>Reduced Narrative: Negative, Moderate, Conflict Rising</s>","<|assistant|>Reduced Narrative: Negative, Moderate, Conflict Rising</s>"
"<s><|user|>Reduce Narrative (sentiment, pacing, plotting): Sarah felt a pang of unease as she entered the dimly lit hallway of the old mansion. The floorboards creaked under her weight, each sound amplifying the ominous atmosphere surrounding her. With her heart pounding, she slowly made her way towards the room at the end of the hallway, where strange whispers seemed to emerge.</s>","<|assistant|>Reduced Narrative: Negative, Moderate, Conflict Rising</s>","<|assistant|>Reduced Narrative: Negative, Moderate, Conflict Rising</s>","<|assistant|>Reduced Narrative: Negative, Moderate, Conflict Rising</s>"
"<s><|user|>Reduce Narrative (sentiment, pacing, plotting): The sound of thunder rumbled in the distance as Sarah hurried through the dark, rain-soaked streets. She clutched the pendant hanging around her neck, the only clue to her mysterious past. Just when she thought she had lost her pursuers, a shadowy figure emerged from the alley, blocking her path. It was him - the man who had been hunting her for months. With a steely determination in her eyes, Sarah knew that this confrontation would decide her fate once and for all.</s>","<|assistant|>Reduced Narrative: Negative, Fast, Conflict Resolving</s>","<|assistant|>Reduced Narrative: Negative, Fast, Conflict Resolving</s>","<|assistant|>Reduced Narrative: Negative, Fast, Conflict Resolving</s>"
"<s><|user|>Reduce Narrative (sentiment, pacing, plotting): Sarah's heart raced as she finally mustered the courage to confront her long-lost sister, who had disappeared without a word years ago. With tears welling up in her eyes, she stood face to face with the person she had been longing to find. In that moment, words seemed insufficient, so Sarah simply wrapped her arms around her sister, feeling the warmth of their reunion washing away years of pain and separation.</s>","<|assistant|>Reduced Narrative: Positive, Fast, Conflict Resolving</s>","<|assistant|>Reduced Narrative: Positive, Fast, Conflict Resolving</s>","<|assistant|>Reduced Narrative: Positive, Fast, Conflict Resolving</s>"
"<s><|user|>Reduce Narrative (sentiment, pacing, plotting): The rain poured relentlessly, a steady drumming on the roof that matched the turmoil inside. Sarah sat by the window, tracing the droplets with her fingers, lost in thoughts too heavy to carry alone. Her relationship with her sister had hit a breaking point, words spoken that couldn't be unsaid. The storm outside mirrored the one in her heart.</s>","<|assistant|>Reduced Narrative: Negative, Slow, Conflict Resolving</s>","<|assistant|>Reduced Narrative: Negative, Slow, Conflict Resolving</s>","<|assistant|>Reduced Narrative: Negative, Slow, Conflict Resolving</s>"
"<s><|user|>Reduce Narrative (sentiment, pacing, plotting): As the storm clouds gathered in the distance, Sarah felt a sense of foreboding wash over her. She knew that her confrontation with her long-lost sister was inevitable, and the tension between them crackled like static electricity in the air.</s>","<|assistant|>Reduced Narrative: Negative, Moderate, Conflict Rising</s>","<|assistant|>Reduced Narrative: Negative, Moderate, Conflict Rising</s>","<|assistant|>Reduced Narrative: Negative, Moderate, Conflict Rising</s>"
"<s><|user|>Reduce Narrative (sentiment, pacing, plotting): The thunderous sound of hooves echoed through the forest as the two rival clans approached each other with tension thick in the air. Anger simmered in their eyes, fueled by years of unresolved disputes and pride that refused to yield.</s>","<|assistant|>Reduced Narrative: Negative, Fast, Conflict Rising</s>","<|assistant|>Reduced Narrative: Negative, Fast, Conflict Rising</s>","<|assistant|>Reduced Narrative: Negative, Fast, Conflict Rising</s>"
"<s><|user|>Reduce Narrative (sentiment, pacing, plotting): Sarah stood at the edge of the cliff, her eyes fixed on the turbulent waves crashing against the rocks below. The salty breeze tousled her hair as she grappled with a decision that could change everything. Far in the distance, a storm was brewing, dark clouds swirling ominously in the sky, mirroring the turmoil within her heart.</s>","<|assistant|>Reduced Narrative: Neutral, Slow, Conflict Rising</s>","<|assistant|>Reduced Narrative: Neutral, Slow, Conflict Rising</s>","<|assistant|>Reduced Narrative: Neutral, Slow, Conflict Rising</s>"
"<s><|user|>Reduce Narrative (sentiment, pacing, plotting): Sarah's heart pounded in her chest as she read the letter in her hands. The neatly written words carried a weight she couldn't ignore. It was the ultimatum she had been dreading, the threat to everything she held dear. She knew a decision loomed, one that would change the course of her life forever.</s>","<|assistant|>Reduced Narrative: Negative, Moderate, Conflict Rising</s>","<|assistant|>Reduced Narrative: Negative, Moderate, Conflict Rising</s>","<|assistant|>Reduced Narrative: Negative, Moderate, Conflict Rising</s>"
"<s><|user|>Reduce Narrative (sentiment, pacing, plotting): The sun dipped below the horizon, casting a warm orange glow over the peaceful village. People gathered in the town square, setting up tables filled with delicious food and colorful decorations. Laughter filled the air as families and friends came together to celebrate the end of a long-standing feud between two rival families. The elders of both clans stood side by side, shaking hands and exchanging heartfelt apologies, marking the beginning of a new era of unity and harmony.</s>","<|assistant|>Reduced Narrative: Positive, Fast, Conflict Resolving</s>","<|assistant|>Reduced Narrative: Positive, Fast, Conflict Resolving</s>","<|assistant|>Reduced Narrative: Positive, Fast, Conflict Resolving</s>"
"<s><|user|>Reduce Narrative (sentiment, pacing, plotting): Sarah stood in front of the old mansion, her heart heavy with regret. The place she once called home now stood as a reminder of broken promises and shattered dreams. As she turned to walk away, a figure emerged from the shadows � her estranged mother. Decades of silence hung between them like a suffocating fog, but in that moment, Sarah saw the pain in her mother's eyes. Without a word spoken, they embraced, letting go of the bitterness that had kept them apart for so long.</s>","<|assistant|>Reduced Narrative: Negative, Moderate, Conflict Resolving</s>","<|assistant|>Reduced Narrative: Negative, Moderate, Conflict Resolving</s>","<|assistant|>Reduced Narrative: Negative, Moderate, Conflict Resolving</s>"
"<s><|user|>Reduce Narrative (sentiment, pacing, plotting): Sarah stood at the edge of the cliff, the wind whipping her hair around wildly. Tears filled her eyes as she replayed the argument with her best friend in her mind. The harsh words said in the heat of the moment lingered in the air like a thick fog. She clenched her fists, trying to push back the hurt and anger that threatened to consume her.</s>","<|assistant|>Reduced Narrative: Negative, Slow, Conflict Resolving</s>","<|assistant|>Reduced Narrative: Negative, Slow, Conflict Resolving</s>","<|assistant|>Reduced Narrative: Negative, Slow, Conflict Resolving</s>"
"<s><|user|>Reduce Narrative (sentiment, pacing, plotting): Lily stood at the crossroads, her heart torn between two paths. One led to familiarity and security, while the other promised adventure and uncertainty. After much deliberation, she took a deep breath and stepped resolutely onto the unknown path, determined to find her own way in the world.</s>","<|assistant|>Reduced Narrative: Neutral, Moderate, Conflict Resolving</s>","<|assistant|>Reduced Narrative: Neutral, Moderate, Conflict Resolving</s>","<|assistant|>Reduced Narrative: Neutral, Moderate, Conflict Resolving</s>"
"<s><|user|>Reduce Narrative (sentiment, pacing, plotting): The rain pounded on the roof, filling the room with a melancholic soundtrack. Sarah sat by the window, her eyes drawn to the dark clouds looming outside. Each drop seemed to echo the turmoil within her heart, mirroring the storm raging both outside and within her soul.</s>","<|assistant|>Reduced Narrative: Negative, Slow, Conflict Rising</s>","<|assistant|>Reduced Narrative: Negative, Slow, Conflict Rising</s>","<|assistant|>Reduced Narrative: Negative, Slow, Conflict Rising</s>"
"<s><|user|>Reduce Narrative (sentiment, pacing, plotting): The rain poured heavily outside, matching the somber mood within the small cafe. Sarah stared at her empty coffee cup, lost in thoughts of the argument she had with her best friend the night before. She replayed their harsh words over and over in her mind, feeling a mix of regret and stubbornness. Suddenly, the door opened, and in walked her best friend, eyes red from tears shed in solitude. Silence filled the air as they both hesitated, unsure of how to mend the deep rift that had formed between them.</s>","<|assistant|>Reduced Narrative: Negative, Slow, Conflict Resolving</s>","<|assistant|>Reduced Narrative: Negative, Slow, Conflict Resolving</s>","<|assistant|>Reduced Narrative: Negative, Slow, Conflict Resolving</s>"
"<s><|user|>Reduce Narrative (sentiment, pacing, plotting): In the quiet countryside, Sarah carefully tended to her garden, the vibrant colors of the blooming flowers a stark contrast to the looming storm clouds on the horizon. Despite the impending weather, she worked methodically, a sense of determination in her eyes as she refused to let the storm dampen her spirits.</s>","<|assistant|>Reduced Narrative: Positive, Slow, Conflict Rising</s>","<|assistant|>Reduced Narrative: Positive, Slow, Conflict Rising</s>","<|assistant|>Reduced Narrative: Positive, Slow, Conflict Rising</s>"
"<s><|user|>Reduce Narrative (sentiment, pacing, plotting): Sarah's heart raced as she hurried through the bustling city streets, the afternoon sun casting long shadows behind her. She clutched a crumpled letter in her hand, the words inside urging her to reach the old bookstore on Maple Street before sunset. With determination in her eyes, she weaved through the crowds, determined to uncover the mysterious secret the letter hinted at.</s>","<|assistant|>Reduced Narrative: Positive, Fast, Conflict Rising</s>","<|assistant|>Reduced Narrative: Positive, Fast, Conflict Rising</s>","<|assistant|>Reduced Narrative: Positive, Fast, Conflict Rising</s>"
"<s><|user|>Reduce Narrative (sentiment, pacing, plotting): As the sun began its descent, casting a warm golden hue over the tranquil meadow, Emma and Lucas sat by the rippling creek, their laughter filling the serene atmosphere. With each shared moment, their friendship grew deeper, weaving a tapestry of trust and understanding that painted the landscape with hues of companionship.</s>","<|assistant|>Reduced Narrative: Positive, Slow, Conflict Resolving</s>","<|assistant|>Reduced Narrative: Positive, Slow, Conflict Resolving</s>","<|assistant|>Reduced Narrative: Positive, Slow, Conflict Resolving</s>"
"<s><|user|>Reduce Narrative (sentiment, pacing, plotting): Jane rushed into the room, her eyes searching frantically until they found Tom sitting by the window. ""Tom, we need to talk,"" she blurted out, breathless from her hurried entrance.</s>","<|assistant|>Reduced Narrative: Neutral, Fast, Conflict Resolving</s>","<|assistant|>Reduced Narrative: Neutral, Fast, Conflict Resolving</s>","<|assistant|>Reduced Narrative: Neutral, Fast, Conflict Resolving</s>"
"<s><|user|>Reduce Narrative (sentiment, pacing, plotting): Sarah's heart raced as she entered the room, anxious to confront her longtime friend about their argument. However, as soon as she saw the remorse in his eyes, her anger dissipated. They sat down, talked it out, and with understanding smiles, their bond grew stronger than before.</s>","<|assistant|>Reduced Narrative: Positive, Fast, Conflict Resolving</s>","<|assistant|>Reduced Narrative: Positive, Fast, Conflict Resolving</s>","<|assistant|>Reduced Narrative: Positive, Fast, Conflict Resolving</s>"
"<s><|user|>Reduce Narrative (sentiment, pacing, plotting): As Sarah hurried through the bustling city streets, the sun dipped lower on the horizon, casting a warm golden glow over the familiar landmarks. Her phone buzzed in her hand, displaying a message that simply read, ""We need to talk."" With each passing minute, her heart raced faster, her mind buzzing with questions and uncertainties.</s>","<|assistant|>Reduced Narrative: Positive, Fast, Conflict Rising</s>","<|assistant|>Reduced Narrative: Positive, Fast, Conflict Rising</s>","<|assistant|>Reduced Narrative: Positive, Fast, Conflict Rising</s>"
"<s><|user|>Reduce Narrative (sentiment, pacing, plotting): The sun was setting over the calm waters of the lake, casting a golden hue over the small cabin nestled among the trees. Inside, two friends sat by the crackling fireplace, their faces illuminated by the dancing flames. They sipped on steaming mugs of tea, the only sound the occasional pop of burning wood.</s>","<|assistant|>Reduced Narrative: Neutral, Slow, Conflict Rising</s>","<|assistant|>Reduced Narrative: Neutral, Slow, Conflict Rising</s>","<|assistant|>Reduced Narrative: Neutral, Slow, Conflict Rising</s>"
"<s><|user|>Reduce Narrative (sentiment, pacing, plotting): Sarah sprinted through the forest, her heart pounding with adrenaline. The sounds of pursuit echoed behind her, spurring her on. Ducking beneath a low branch, she reached the clearing where her friends awaited. With a triumphant grin, Sarah hoisted the flag high, securing victory in the game of capture the flag.</s>","<|assistant|>Reduced Narrative: Neutral, Fast, Conflict Resolving</s>","<|assistant|>Reduced Narrative: Neutral, Fast, Conflict Resolving</s>","<|assistant|>Reduced Narrative: Neutral, Fast, Conflict Resolving</s>"
"<s><|user|>Reduce Narrative (sentiment, pacing, plotting): As the dark clouds gathered overhead, Sarah felt a sense of unease creeping into her mind. She had a crucial presentation at work tomorrow, and the looming storm mirrored the uncertainty she felt about its outcome. Determined not to let her anxiety get the best of her, she resolved to perfect her slides one last time before heading to bed.</s>","<|assistant|>Reduced Narrative: Neutral, Fast, Conflict Resolving</s>","<|assistant|>Reduced Narrative: Neutral, Fast, Conflict Resolving</s>","<|assistant|>Reduced Narrative: Neutral, Fast, Conflict Resolving</s>"
"<s><|user|>Reduce Narrative (sentiment, pacing, plotting): As the storm clouds gathered in the sky, Sarah and Mark looked at each other with worried expressions. The wind picked up, rustling the leaves ominously. They knew their camping trip was about to take a turn for the worse.</s>","<|assistant|>Reduced Narrative: Negative, Moderate, Conflict Rising</s>","<|assistant|>Reduced Narrative: Negative, Moderate, Conflict Rising</s>","<|assistant|>Reduced Narrative: Negative, Moderate, Conflict Rising</s>"
"<s><|user|>Reduce Narrative (sentiment, pacing, plotting): As the sun began to set, casting long shadows across the rolling hills, Sarah and Mark sat on the porch. The silence between them was heavy, filled with unspoken words that hovered in the cool evening air. Finally, Sarah spoke up, her voice barely more than a whisper, ""I think it's time we talked about what's been happening between us.""</s>","<|assistant|>Reduced Narrative: Negative, Slow, Conflict Resolving</s>","<|assistant|>Reduced Narrative: Negative, Slow, Conflict Resolving</s>","<|assistant|>Reduced Narrative: Negative, Slow, Conflict Resolving</s>"
"<s><|user|>Reduce Narrative (sentiment, pacing, plotting): Sarah stood at the edge of the forest, the sun painting the sky in hues of orange and pink as it dipped towards the horizon. She knew venturing further would lead to the heart of the woods, where rumors whispered of a mystical fountain granting wishes. Determined, Sarah took a deep breath and stepped into the shadows, her heart beating with both excitement and apprehension.</s>","<|assistant|>Reduced Narrative: Positive, Moderate, Conflict Rising</s>","<|assistant|>Reduced Narrative: Positive, Moderate, Conflict Rising</s>","<|assistant|>Reduced Narrative: Positive, Moderate, Conflict Rising</s>"
"<s><|user|>Reduce Narrative (sentiment, pacing, plotting): The air in the room grew heavy with unspoken tension as she quietly slammed the door shut behind her. His eyes, usually warm pools of understanding, now betrayed a flicker of irritation. They both knew the conversation they were about to have would change everything. She took a deep breath, bracing herself for the looming storm of words that were about to pour out.</s>","<|assistant|>Reduced Narrative: Negative, Slow, Conflict Rising</s>","<|assistant|>Reduced Narrative: Negative, Slow, Conflict Rising</s>","<|assistant|>Reduced Narrative: Negative, Slow, Conflict Rising</s>"
"<s><|user|>Reduce Narrative (sentiment, pacing, plotting): Sarah hesitated as she stood at the crossroads, uncertain which path to take. The sun painted the sky with vibrant hues of orange and pink, casting a warm glow that enveloped her. Memories of past doubts and fears flooded her mind, but this time, she felt a newfound sense of clarity. With a deep breath, Sarah chose a direction and started walking, the weight of indecision lifting off her shoulders.</s>","<|assistant|>Reduced Narrative: Positive, Moderate, Conflict Resolving</s>","<|assistant|>Reduced Narrative: Positive, Moderate, Conflict Resolving</s>","<|assistant|>Reduced Narrative: Positive, Moderate, Conflict Resolving</s>"
"<s><|user|>Reduce Narrative (sentiment, pacing, plotting): The rain poured relentlessly outside, creating a rhythmic drumming against the windows. Inside, Sarah sat on the old, worn-out couch, staring emptily at the flickering TV screen. Memories of arguments and cold silences lingered in the air around her, permeating the once warm and cozy living room.</s>","<|assistant|>Reduced Narrative: Negative, Moderate, Conflict Resolving</s>","<|assistant|>Reduced Narrative: Negative, Moderate, Conflict Resolving</s>","<|assistant|>Reduced Narrative: Negative, Moderate, Conflict Resolving</s>"
"<s><|user|>Reduce Narrative (sentiment, pacing, plotting): The dark clouds gathered ominously in the sky, casting a shadow over the small village below. The villagers whispered among themselves, sensing a looming threat in the air. Sarah, a young herbalist known for her wisdom, felt a deep unease settling in her heart as she gazed at the distant mountains shrouded in mist. It was as if the very landscape itself knew of the impending danger that approached.</s>","<|assistant|>Reduced Narrative: Negative, Slow, Conflict Rising</s>","<|assistant|>Reduced Narrative: Negative, Slow, Conflict Rising</s>","<|assistant|>Reduced Narrative: Negative, Slow, Conflict Rising</s>"
"<s><|user|>Reduce Narrative (sentiment, pacing, plotting): Sarah stood at the edge of the forest, her heart pounding as she peered into the darkness. The rustling of leaves and distant howls of wolves created an eerie atmosphere. She gripped the locket around her neck, a gift from her grandmother said to protect its wearer. As she took a hesitant step forward, a faint whisper echoed in the night, sending shivers down her spine.</s>","<|assistant|>Reduced Narrative: Neutral, Moderate, Conflict Rising</s>","<|assistant|>Reduced Narrative: Neutral, Moderate, Conflict Rising</s>","<|assistant|>Reduced Narrative: Neutral, Moderate, Conflict Rising</s>"
"<s><|user|>Reduce Narrative (sentiment, pacing, plotting): As the sun dipped below the horizon, casting a warm glow over the tranquil meadow, Sarah's heart raced with excitement. Tomorrow was the day she would embark on her first solo journey through the enchanted forest that bordered her village. The thought of the unknown creatures and hidden treasures awaiting her filled her with a mix of anticipation and nervous energy.</s>","<|assistant|>Reduced Narrative: Positive, Moderate, Conflict Rising</s>","<|assistant|>Reduced Narrative: Positive, Moderate, Conflict Rising</s>","<|assistant|>Reduced Narrative: Positive, Moderate, Conflict Rising</s>"
"<s><|user|>Reduce Narrative (sentiment, pacing, plotting): Sarah's heart raced as she finally stepped into the crowded auditorium. She looked out at the sea of expectant faces, her hands slightly trembling. As she began to sing, her voice filled the room, capturing the attention of everyone present. The audience fell silent, completely captivated by the power and emotion in her voice. When she finished her last note, the room erupted into thunderous applause, echoing with cheers and whistles.</s>","<|assistant|>Reduced Narrative: Positive, Fast, Conflict Resolving</s>","<|assistant|>Reduced Narrative: Positive, Fast, Conflict Resolving</s>","<|assistant|>Reduced Narrative: Positive, Fast, Conflict Resolving</s>"
"<s><|user|>Reduce Narrative (sentiment, pacing, plotting): Sarah's heart raced as she stood in the doorway, hesitant to knock. She took a deep breath and rapped lightly on the wooden frame. After a few agonizing seconds, the door creaked open, revealing her best friend's beaming face. ""Sarah! You came back!"" Her friend's warm embrace melted away the tension that had been festering for weeks.</s>","<|assistant|>Reduced Narrative: Positive, Fast, Conflict Resolving</s>","<|assistant|>Reduced Narrative: Positive, Fast, Conflict Resolving</s>","<|assistant|>Reduced Narrative: Positive, Fast, Conflict Resolving</s>"
"<s><|user|>Reduce Narrative (sentiment, pacing, plotting): As the sun dipped below the horizon, casting a warm golden glow over the rolling hills, Sarah and Peter sat on the porch swing, hands intertwined. The gentle breeze carried the sweet scent of blooming lilacs, enveloping them in a peaceful moment of tranquility. Sarah broke the silence with a soft smile, ""I'm sorry for the misunderstandings, Peter. Can we try to understand each other better?"" Peter's eyes softened as he nodded, ""I want that too, Sarah. Let's communicate openly from now on.""</s>","<|assistant|>Reduced Narrative: Positive, Slow, Conflict Resolving</s>","<|assistant|>Reduced Narrative: Positive, Slow, Conflict Resolving</s>","<|assistant|>Reduced Narrative: Positive, Slow, Conflict Resolving</s>"
"<s><|user|>Reduce Narrative (sentiment, pacing, plotting): Sarah sat in the dimly lit cafe, nervously tapping her foot as she waited for Liam to arrive. They hadn't seen each other in months, and their last encounter ended in a heated argument. She took a deep breath, preparing herself for whatever was about to unfold, unsure if this meeting would bring closure or chaos.</s>","<|assistant|>Reduced Narrative: Neutral, Moderate, Conflict Rising</s>","<|assistant|>Reduced Narrative: Neutral, Moderate, Conflict Rising</s>","<|assistant|>Reduced Narrative: Neutral, Moderate, Conflict Rising</s>"
"<s><|user|>Reduce Narrative (sentiment, pacing, plotting): As the sun dipped below the horizon, casting a warm glow over the tranquil meadow, Sarah's heart felt heavy. She watched as the last petal fell from the wilting flower in her hand, a symbol of the fading hope she held onto so dearly. Thoughts raced through her mind, wondering how to mend what seemed irreparable.</s>","<|assistant|>Reduced Narrative: Neutral, Moderate, Conflict Rising</s>","<|assistant|>Reduced Narrative: Neutral, Moderate, Conflict Rising</s>","<|assistant|>Reduced Narrative: Neutral, Moderate, Conflict Rising</s>"
