text,text,label,target
"<s><|user|>Reduce Narrative (sentiment, pacing, plotting): Sarah stood at the edge of the cliff, the wind tugging at her hair as she took a deep breath. Her heart raced with excitement and nerves as she prepared to base jump, a dream she had nurtured for years. With a final mental check of her gear, she leaped off the rocky precipice, feeling the sheer thrill of free-falling before her parachute bloomed open above her, carrying her safely down to the ground below.</s>","<|assistant|>Reduced Narrative: Neutral, Fast, Conflict Resolving</s>","<|assistant|>Reduced Narrative: Neutral, Fast, Conflict Resolving</s>","<|assistant|>Reduced Narrative: Neutral, Fast, Conflict Resolving</s>"
"<s><|user|>Reduce Narrative (sentiment, pacing, plotting): As the storm clouds gathered ominously in the sky, Sarah and Tom stood facing each other, their words laced with hurt and frustration. Their relationship had weathered many challenges, but this felt like the breaking point. Sarah's eyes teared up as she whispered, ""I can't do this anymore."" Tom's expression softened, realizing the weight of her words. In that heartbreaking moment, they knew they had to let go to find their own paths.</s>","<|assistant|>Reduced Narrative: Negative, Slow, Conflict Resolving</s>","<|assistant|>Reduced Narrative: Negative, Slow, Conflict Resolving</s>","<|assistant|>Reduced Narrative: Negative, Slow, Conflict Resolving</s>"
"<s><|user|>Reduce Narrative (sentiment, pacing, plotting): Emily's heart raced as she stood at the edge of the forest, unsure of what she might find within its mysterious depths. With a deep breath, she stepped forward, the trees almost seeming to whisper secrets that rustled through the leaves. There was a sense of foreboding, but also an undeniable curiosity pulling her further in.</s>","<|assistant|>Reduced Narrative: Positive, Moderate, Conflict Rising</s>","<|assistant|>Reduced Narrative: Positive, Moderate, Conflict Rising</s>","<|assistant|>Reduced Narrative: Positive, Moderate, Conflict Rising</s>"
"<s><|user|>Reduce Narrative (sentiment, pacing, plotting): Sarah took a deep breath, her heart pounding with excitement as she stood on the edge of the cliff, overlooking the vast expanse of the valley below. The wind tousled her hair, carrying the sounds of chirping birds and rustling leaves. She knew this moment would change everything. With a determined gaze, she spread her arms wide and jumped, feeling a rush of adrenaline as she soared through the air.</s>","<|assistant|>Reduced Narrative: Positive, Moderate, Conflict Rising</s>","<|assistant|>Reduced Narrative: Positive, Moderate, Conflict Rising</s>","<|assistant|>Reduced Narrative: Positive, Moderate, Conflict Rising</s>"
"<s><|user|>Reduce Narrative (sentiment, pacing, plotting): The moon hung low in the night sky, casting eerie shadows across the deserted street. A lone figure stepped out from the darkness, their footsteps echoing in the silence. As they walked, the faint sound of a distant siren caught their attention, a grim reminder of the chaos that lurked just beyond the safety of their current location.</s>","<|assistant|>Reduced Narrative: Negative, Slow, Conflict Rising</s>","<|assistant|>Reduced Narrative: Negative, Slow, Conflict Rising</s>","<|assistant|>Reduced Narrative: Negative, Slow, Conflict Rising</s>"
"<s><|user|>Reduce Narrative (sentiment, pacing, plotting): Sarah's heart raced as she approached the old mansion, knowing that inside, her estranged brother awaited. The door creaked open, and there he stood, a mix of surprise and relief on his face as he saw her. Without a word, they embraced, years of misunderstanding melting away in that moment of silent reconciliation.</s>","<|assistant|>Reduced Narrative: Positive, Moderate, Conflict Resolving</s>","<|assistant|>Reduced Narrative: Positive, Moderate, Conflict Resolving</s>","<|assistant|>Reduced Narrative: Positive, Moderate, Conflict Resolving</s>"
"<s><|user|>Reduce Narrative (sentiment, pacing, plotting): The sky darkened as ominous clouds gathered overhead, casting an eerie shadow over the deserted village. An unspoken tension filled the air, an unresolved conflict lurking beneath the surface. Sarah's footsteps echoed as she cautiously made her way through the narrow streets, the weight of the past heavy on her shoulders. She stopped in front of a dilapidated house, its windows shattered, a haunting reminder of what once was. With a trembling hand, she pushed open the creaking door, steeling herself for the confrontation that awaited her inside.</s>","<|assistant|>Reduced Narrative: Negative, Slow, Conflict Resolving</s>","<|assistant|>Reduced Narrative: Negative, Slow, Conflict Resolving</s>","<|assistant|>Reduced Narrative: Negative, Slow, Conflict Resolving</s>"
"<s><|user|>Reduce Narrative (sentiment, pacing, plotting): A cool breeze rustled the leaves of the ancient oak tree, its branches reaching out to the sky like aged fingers grasping for the sun's warmth. The village below bustled with life, the laughter of children mixing with the clinking of market vendors' wares. Amongst this cheerful chaos, two figures could be seen standing by the well, their voices hushed as if sharing a secret amidst the noisy backdrop.</s>","<|assistant|>Reduced Narrative: Neutral, Slow, Conflict Rising</s>","<|assistant|>Reduced Narrative: Neutral, Slow, Conflict Rising</s>","<|assistant|>Reduced Narrative: Neutral, Slow, Conflict Rising</s>"
"<s><|user|>Reduce Narrative (sentiment, pacing, plotting): As the rain hammered against the window panes, Sarah and Mark sat in silence, their tension palpable in the air. Finally, Sarah broke the quietude, her voice trembling as she voiced her long-held frustrations. Mark listened, his expression softening as he realized the pain he had caused. Slowly, apologies and understanding bridged the gap between them, the storm outside mirroring the storm within their hearts, now slowly subsiding.</s>","<|assistant|>Reduced Narrative: Negative, Moderate, Conflict Resolving</s>","<|assistant|>Reduced Narrative: Negative, Moderate, Conflict Resolving</s>","<|assistant|>Reduced Narrative: Negative, Moderate, Conflict Resolving</s>"
"<s><|user|>Reduce Narrative (sentiment, pacing, plotting): As the sun began its descent, casting a warm glow over the rolling hills, Olivia and Jacob sat on the porch swing, their fingers intertwined. They had come a long way since their disagreement over where to spend the summer vacation. However, the peaceful evening and their shared laughter now seemed to mend the rift between them, paving the way for understanding and compromise.</s>","<|assistant|>Reduced Narrative: Positive, Slow, Conflict Resolving</s>","<|assistant|>Reduced Narrative: Positive, Slow, Conflict Resolving</s>","<|assistant|>Reduced Narrative: Positive, Slow, Conflict Resolving</s>"
"<s><|user|>Reduce Narrative (sentiment, pacing, plotting): As the sun dipped below the horizon, casting hues of orange and pink across the sky, Sarah and Tom sat at the edge of the cliff overlooking the vast ocean below. The gentle sound of waves crashing against the rocks created a serene backdrop for their conversation. Sarah took a deep breath, breaking the comfortable silence that had settled between them for the past few moments.</s>","<|assistant|>Reduced Narrative: Neutral, Slow, Conflict Resolving</s>","<|assistant|>Reduced Narrative: Neutral, Slow, Conflict Resolving</s>","<|assistant|>Reduced Narrative: Neutral, Slow, Conflict Resolving</s>"
"<s><|user|>Reduce Narrative (sentiment, pacing, plotting): Sarah stood in front of the old, weather-beaten house, a box of memories in her hands. With a deep breath, she pushed open the creaking door, memories flooding back. As she wandered through the rooms, emotion welled up inside her, but this time it was different. There was a sense of closure, of acceptance that whispered through the dusty air. She reached the attic, where the light filtered through the small window, illuminating a forgotten painting. Tears welled in her eyes, not of sadness, but of gratitude for everything that led her here.</s>","<|assistant|>Reduced Narrative: Positive, Slow, Conflict Resolving</s>","<|assistant|>Reduced Narrative: Positive, Slow, Conflict Resolving</s>","<|assistant|>Reduced Narrative: Positive, Slow, Conflict Resolving</s>"
"<s><|user|>Reduce Narrative (sentiment, pacing, plotting): In the small village of Greenbrook, the arrival of spring brought with it a flurry of activity. The flowers bloomed in vibrant hues, painting the landscape with nature's brush. Despite the beauty around them, whispers among the villagers hinted at an ancient feud reigniting between the Redwood and Willow families, casting a shadow over the usually peaceful community.</s>","<|assistant|>Reduced Narrative: Positive, Slow, Conflict Rising</s>","<|assistant|>Reduced Narrative: Positive, Slow, Conflict Rising</s>","<|assistant|>Reduced Narrative: Positive, Slow, Conflict Rising</s>"
"<s><|user|>Reduce Narrative (sentiment, pacing, plotting): The wind howled outside, rattling the windows of the old cabin. Inside, Jake and Sarah sat in tense silence, their argument from earlier still lingering in the air like a heavy fog. Sarah finally broke the quiet, her voice sharp with frustration, ""I can't do this anymore, Jake. We can't keep pretending everything's okay when it's clearly not.""</s>","<|assistant|>Reduced Narrative: Negative, Fast, Conflict Rising</s>","<|assistant|>Reduced Narrative: Negative, Fast, Conflict Rising</s>","<|assistant|>Reduced Narrative: Negative, Fast, Conflict Rising</s>"
"<s><|user|>Reduce Narrative (sentiment, pacing, plotting): As the storm clouds gathered overhead, tension crackled in the air between the two siblings. They had been at odds for days, their disagreements escalating with each passing moment. However, a sudden bolt of lightning striking nearby jolted them out of their argument. Fear replaced anger in their eyes as they realized they needed to put aside their differences and work together to seek shelter before the storm unleashed its fury.</s>","<|assistant|>Reduced Narrative: Negative, Fast, Conflict Resolving</s>","<|assistant|>Reduced Narrative: Negative, Fast, Conflict Resolving</s>","<|assistant|>Reduced Narrative: Negative, Fast, Conflict Resolving</s>"
"<s><|user|>Reduce Narrative (sentiment, pacing, plotting): Sarah rushed into the room, her eyes wide with excitement. ""I have fantastic news!"" she exclaimed. Everyone turned to her, curiosity evident on their faces. Sarah took a deep breath, a wide smile spreading on her face as she shared the news of a generous donation that would save their struggling community center from closing down. A wave of relief and joy washed over the room as they realized their beloved center was safe.</s>","<|assistant|>Reduced Narrative: Positive, Fast, Conflict Resolving</s>","<|assistant|>Reduced Narrative: Positive, Fast, Conflict Resolving</s>","<|assistant|>Reduced Narrative: Positive, Fast, Conflict Resolving</s>"
"<s><|user|>Reduce Narrative (sentiment, pacing, plotting): Sarah stood at the edge of the cliff, the wind tugging at her hair as she gazed out at the vast ocean below. She clenched a letter in her hand, the words inside urging her to take a leap of faith. With a deep breath, she unfolded the paper and let the wind carry it away. As the letter disappeared into the horizon, a sense of relief washed over her, replaced by a newfound resolve to embrace the unknown.</s>","<|assistant|>Reduced Narrative: Neutral, Moderate, Conflict Resolving</s>","<|assistant|>Reduced Narrative: Neutral, Moderate, Conflict Resolving</s>","<|assistant|>Reduced Narrative: Neutral, Moderate, Conflict Resolving</s>"
"<s><|user|>Reduce Narrative (sentiment, pacing, plotting): Sarah stood in front of the mirror, her hands trembling as she held the envelope that contained the results of her exam. With a deep breath, she slowly opened it, her heart pounding in her chest. As her eyes scanned the page, relief flooded through her. She had passed, securing her place in the medical school she had dreamed of attending.</s>","<|assistant|>Reduced Narrative: Positive, Moderate, Conflict Resolving</s>","<|assistant|>Reduced Narrative: Positive, Moderate, Conflict Resolving</s>","<|assistant|>Reduced Narrative: Positive, Moderate, Conflict Resolving</s>"
"<s><|user|>Reduce Narrative (sentiment, pacing, plotting): Sarah braced herself as she knocked on the door, her heart pounding. The door creaked open, revealing her estranged sister standing on the other side. Without a word, they locked eyes, years of grievances hanging in the air between them. Slowly, a tentative smile formed on Sarah's sister's lips, and she reached out for an embrace.</s>","<|assistant|>Reduced Narrative: Neutral, Fast, Conflict Resolving</s>","<|assistant|>Reduced Narrative: Neutral, Fast, Conflict Resolving</s>","<|assistant|>Reduced Narrative: Neutral, Fast, Conflict Resolving</s>"
"<s><|user|>Reduce Narrative (sentiment, pacing, plotting): Sarah's heart pounded as she read the letter, the words on the page causing her blood to run cold. The news it contained was enough to shake the foundation of the life she had painstakingly built for years.</s>","<|assistant|>Reduced Narrative: Negative, Fast, Conflict Rising</s>","<|assistant|>Reduced Narrative: Negative, Fast, Conflict Rising</s>","<|assistant|>Reduced Narrative: Negative, Fast, Conflict Rising</s>"
"<s><|user|>Reduce Narrative (sentiment, pacing, plotting): Lily dashed through the crowded marketplace, clutching the precious artifact in her hands. She could hear the distant shouts of the pursuers, but determination fueled her steps as she weaved expertly through the maze of stalls and carts. The sun cast golden rays over the ancient city, adding a sense of urgency to her mission.</s>","<|assistant|>Reduced Narrative: Positive, Fast, Conflict Rising</s>","<|assistant|>Reduced Narrative: Positive, Fast, Conflict Rising</s>","<|assistant|>Reduced Narrative: Positive, Fast, Conflict Rising</s>"
"<s><|user|>Reduce Narrative (sentiment, pacing, plotting): The sun slowly dipped below the horizon, casting a warm, golden glow over the peaceful meadow. A gentle breeze whispered through the trees, carrying with it the sweet scent of wildflowers. As the day faded into twilight, two figures emerged from the edge of the forest, their arms linked in a gesture of newfound camaraderie. Their laughter filled the air, echoing across the tranquil landscape, a stark contrast to the tension that had once divided them.</s>","<|assistant|>Reduced Narrative: Positive, Slow, Conflict Resolving</s>","<|assistant|>Reduced Narrative: Positive, Slow, Conflict Resolving</s>","<|assistant|>Reduced Narrative: Positive, Slow, Conflict Resolving</s>"
"<s><|user|>Reduce Narrative (sentiment, pacing, plotting): As the sun dipped below the horizon, casting a warm glow over the tranquil meadow, Sarah and David finally found the courage to open up about their past misunderstandings. The gentle breeze carried their words with a newfound sense of vulnerability, intertwining their stories like intricate lacework. With each shared revelation, the weight of unspoken grievances lifted, paving the way for a deeper connection to blossom between them.</s>","<|assistant|>Reduced Narrative: Positive, Slow, Conflict Resolving</s>","<|assistant|>Reduced Narrative: Positive, Slow, Conflict Resolving</s>","<|assistant|>Reduced Narrative: Positive, Slow, Conflict Resolving</s>"
"<s><|user|>Reduce Narrative (sentiment, pacing, plotting): The storm clouds looming overhead mirrored the turbulent emotions within Max's heart. As he watched the rain cascade down the window, memories of heated arguments replayed in his mind. He clenched his fists, feeling the weight of unresolved issues hanging heavy in the air.</s>","<|assistant|>Reduced Narrative: Negative, Fast, Conflict Rising</s>","<|assistant|>Reduced Narrative: Negative, Fast, Conflict Rising</s>","<|assistant|>Reduced Narrative: Negative, Fast, Conflict Rising</s>"
"<s><|user|>Reduce Narrative (sentiment, pacing, plotting): Sarah rushed into the room, her heart pounding with anticipation. She found her long-lost brother sitting by the window, staring out at the setting sun. Tears welled up in her eyes as she called out his name. He turned, and in that moment, years of separation dissolved as they ran into each other's arms, finally reunited.</s>","<|assistant|>Reduced Narrative: Neutral, Fast, Conflict Resolving</s>","<|assistant|>Reduced Narrative: Neutral, Fast, Conflict Resolving</s>","<|assistant|>Reduced Narrative: Neutral, Fast, Conflict Resolving</s>"
"<s><|user|>Reduce Narrative (sentiment, pacing, plotting): As the storm clouds loomed ominously overhead, Sarah rushed through the darkened streets, desperately searching for her lost dog. The howling wind echoed her anxious heartbeat, and the rain blurred her vision, adding to the growing sense of dread that gripped her with each passing moment.</s>","<|assistant|>Reduced Narrative: Negative, Fast, Conflict Rising</s>","<|assistant|>Reduced Narrative: Negative, Fast, Conflict Rising</s>","<|assistant|>Reduced Narrative: Negative, Fast, Conflict Rising</s>"
"<s><|user|>Reduce Narrative (sentiment, pacing, plotting): The sun sank below the horizon, casting long shadows across the empty street. Sarah stood at the window, watching the darkness creep in, her heart heavy with worry. She had been avoiding this moment for days, but there was no more hiding. Taking a deep breath, she picked up the phone and dialed the number she had memorized long ago. The ringing felt like an eternity until a voice finally answered on the other end.</s>","<|assistant|>Reduced Narrative: Negative, Slow, Conflict Resolving</s>","<|assistant|>Reduced Narrative: Negative, Slow, Conflict Resolving</s>","<|assistant|>Reduced Narrative: Negative, Slow, Conflict Resolving</s>"
"<s><|user|>Reduce Narrative (sentiment, pacing, plotting): As the sun dipped below the horizon, casting its warm orange glow over the tranquil meadow, Sarah felt a faint tremor of unease prickling at her skin. Shadows elongated, dancing on the grass like mischievous spirits whispering secrets to the evening breeze. She knew she wasn't alone; a lurking presence hovered just beyond the edge of sight, causing her heart to drum a faster rhythm against her ribcage.</s>","<|assistant|>Reduced Narrative: Neutral, Slow, Conflict Rising</s>","<|assistant|>Reduced Narrative: Neutral, Slow, Conflict Rising</s>","<|assistant|>Reduced Narrative: Neutral, Slow, Conflict Rising</s>"
"<s><|user|>Reduce Narrative (sentiment, pacing, plotting): Sarah stood at the edge of the cliff, her heart pounding in her chest. The wind whipped through her hair, carrying the sounds of distant waves crashing against the shore below. She clutched the letter in her hand, the words on the page like a heavy weight on her shoulders. With a deep breath, she stepped forward, letting the paper slip from her fingers and flutter down into the churning ocean.</s>","<|assistant|>Reduced Narrative: Negative, Moderate, Conflict Resolving</s>","<|assistant|>Reduced Narrative: Negative, Moderate, Conflict Resolving</s>","<|assistant|>Reduced Narrative: Negative, Moderate, Conflict Resolving</s>"
"<s><|user|>Reduce Narrative (sentiment, pacing, plotting): The sun dipped below the horizon, casting a warm glow across the tranquil meadow. Emily's heart raced as she approached the old oak tree where she had hidden a mysterious treasure map discovered in her grandmother's attic. With each step, the rustling leaves and the fading light fueled her excitement, igniting a spark of adventure within her soul. As she reached the tree and studied the map under the last rays of daylight, a faint sound of footsteps in the distance hinted at someone else being drawn to the same spot.</s>","<|assistant|>Reduced Narrative: Positive, Fast, Conflict Rising</s>","<|assistant|>Reduced Narrative: Positive, Fast, Conflict Rising</s>","<|assistant|>Reduced Narrative: Positive, Fast, Conflict Rising</s>"
"<s><|user|>Reduce Narrative (sentiment, pacing, plotting): In the dimly lit room, tension hung in the air like a heavy fog. Sarah and Mark sat across from each other, the distance between them feeling insurmountable. Words had been said, wounds had been reopened, and the space between them seemed to widen with each passing moment. Sarah finally broke the silence, her voice barely above a whisper, ""I can't do this anymore, Mark.""</s>","<|assistant|>Reduced Narrative: Negative, Slow, Conflict Resolving</s>","<|assistant|>Reduced Narrative: Negative, Slow, Conflict Resolving</s>","<|assistant|>Reduced Narrative: Negative, Slow, Conflict Resolving</s>"
"<s><|user|>Reduce Narrative (sentiment, pacing, plotting): As the sun peeked over the horizon, casting a warm glow over the meadow, Sarah and John sat down under the old oak tree, their once tense expressions now softening into understanding. Sarah reached out a hand, and John took it, his eyes reflecting a mix of relief and love. The long-standing rift between them was finally beginning to heal, the wounds of the past slowly being soothed by their shared commitment to rebuild their relationship.</s>","<|assistant|>Reduced Narrative: Positive, Moderate, Conflict Resolving</s>","<|assistant|>Reduced Narrative: Positive, Moderate, Conflict Resolving</s>","<|assistant|>Reduced Narrative: Positive, Moderate, Conflict Resolving</s>"
"<s><|user|>Reduce Narrative (sentiment, pacing, plotting): Emily's heart pounded as she peered through the dense foliage, her eyes fixed on the mysterious figure moving stealthily in the moonlit clearing. She knew she was risking everything by getting involved, but the caller's plea for help had stirred something in her that she couldn't ignore. With a deep breath, she stepped forward, her determination overshadowing the fear that gripped her.</s>","<|assistant|>Reduced Narrative: Positive, Moderate, Conflict Rising</s>","<|assistant|>Reduced Narrative: Positive, Moderate, Conflict Rising</s>","<|assistant|>Reduced Narrative: Positive, Moderate, Conflict Rising</s>"
"<s><|user|>Reduce Narrative (sentiment, pacing, plotting): As the sun began its descent, casting a warm orange glow over the horizon, Sarah and Mark sat on the porch swing, a comfortable silence enveloping them. Mark reached out to take Sarah's hand, a small smile playing on his lips. ""I've been meaning to tell you something,"" he started softly, his eyes locking with hers.</s>","<|assistant|>Reduced Narrative: Neutral, Slow, Conflict Resolving</s>","<|assistant|>Reduced Narrative: Neutral, Slow, Conflict Resolving</s>","<|assistant|>Reduced Narrative: Neutral, Slow, Conflict Resolving</s>"
"<s><|user|>Reduce Narrative (sentiment, pacing, plotting): The sky darkened ominously as thunder rumbled in the distance, setting a foreboding tone over the sleepy town of Willow Creek. Sarah hurried down the deserted streets, her heart pounding with fear. She had sensed something twisted lurking in the shadows, following her every step. A sudden gust of wind extinguished the streetlights, plunging her into utter darkness.</s>","<|assistant|>Reduced Narrative: Negative, Moderate, Conflict Rising</s>","<|assistant|>Reduced Narrative: Negative, Moderate, Conflict Rising</s>","<|assistant|>Reduced Narrative: Negative, Moderate, Conflict Rising</s>"
"<s><|user|>Reduce Narrative (sentiment, pacing, plotting): Lily stood at the edge of the cliff, the wind tousling her hair as she gazed over the vast expanse of the ocean below. Memories of her childhood rushed back, overwhelming her with a mix of nostalgia and sadness. She closed her eyes, taking a deep breath, trying to find peace within herself amidst the chaos of emotions.</s>","<|assistant|>Reduced Narrative: Neutral, Moderate, Conflict Resolving</s>","<|assistant|>Reduced Narrative: Neutral, Moderate, Conflict Resolving</s>","<|assistant|>Reduced Narrative: Neutral, Moderate, Conflict Resolving</s>"
"<s><|user|>Reduce Narrative (sentiment, pacing, plotting): Jane's heart raced as she stumbled upon the forgotten diary in the attic, its dusty cover whispering secrets of the past. Each page held snippets of her grandmother's life, unraveling a mystery that had long remained shrouded in family lore.</s>","<|assistant|>Reduced Narrative: Positive, Moderate, Conflict Rising</s>","<|assistant|>Reduced Narrative: Positive, Moderate, Conflict Rising</s>","<|assistant|>Reduced Narrative: Positive, Moderate, Conflict Rising</s>"
"<s><|user|>Reduce Narrative (sentiment, pacing, plotting): The storm clouds gathered ominously on the horizon, casting a shadow over the once vibrant village. The townspeople exchanged worried glances, whispering fearful rumors about the impending darkness that threatened to consume their homes.</s>","<|assistant|>Reduced Narrative: Negative, Moderate, Conflict Rising</s>","<|assistant|>Reduced Narrative: Negative, Moderate, Conflict Rising</s>","<|assistant|>Reduced Narrative: Negative, Moderate, Conflict Rising</s>"
