text,text,label,target
"<s><|user|>Reduce Narrative (sentiment, pacing, plotting): As the storm clouds gathered ominously overhead, Sarah felt a knot of fear twist in her stomach. She had to find a way to reach her stranded family on the other side of the river before the torrential rain hit and the waters surged. With each passing minute, the bridge seemed farther away, and time was slipping through her fingers like slippery eels.</s>","<|assistant|>Reduced Narrative: Negative, Fast, Conflict Rising</s>","<|assistant|>Reduced Narrative: Negative, Fast, Conflict Rising</s>","<|assistant|>Reduced Narrative: Negative, Fast, Conflict Rising</s>"
"<s><|user|>Reduce Narrative (sentiment, pacing, plotting): As the sun dipped below the horizon, casting a golden hue over the rolling hills, Emily found herself staring at the letter in her hands. The words on the paper seemed to blur together, a mix of sorrow and determination filling her heart. Tomorrow, she would have to confront the past she had long tried to bury.</s>","<|assistant|>Reduced Narrative: Neutral, Moderate, Conflict Rising</s>","<|assistant|>Reduced Narrative: Neutral, Moderate, Conflict Rising</s>","<|assistant|>Reduced Narrative: Neutral, Moderate, Conflict Rising</s>"
"<s><|user|>Reduce Narrative (sentiment, pacing, plotting): Sarah stood nervously in front of the old house, unsure of what to expect when she knocked on the weathered door. She took a deep breath, gathered her courage, and rapped on the wood. After a moment that felt like an eternity, the door creaked open, revealing a kind-looking elderly woman who smiled warmly at Sarah.</s>","<|assistant|>Reduced Narrative: Neutral, Moderate, Conflict Resolving</s>","<|assistant|>Reduced Narrative: Neutral, Moderate, Conflict Resolving</s>","<|assistant|>Reduced Narrative: Neutral, Moderate, Conflict Resolving</s>"
"<s><|user|>Reduce Narrative (sentiment, pacing, plotting): The storm outside raged on, its wrath embodied in the howling wind that battered against the windows. Inside, two siblings, Lily and Alex, faced each other in heated argument. Tears streamed down Lily's face as Alex stood firm, his voice sharp with accusation. ""You always make everything about you!"" he shouted, his words like daggers in the tense room. Lily, usually calm, couldn't contain her frustration anymore. ""You never listen to me!"" she retaliated, her own pain evident in her trembling voice. The clash of emotions seemed to mirror the storm outside, both forces escalating with no end in sight.</s>","<|assistant|>Reduced Narrative: Negative, Fast, Conflict Resolving</s>","<|assistant|>Reduced Narrative: Negative, Fast, Conflict Resolving</s>","<|assistant|>Reduced Narrative: Negative, Fast, Conflict Resolving</s>"
"<s><|user|>Reduce Narrative (sentiment, pacing, plotting): The room fell into an uneasy silence as Sarah's words hung in the air. Her sister, Emily, stared at her with a mix of hurt and anger reflected in her eyes. Sarah felt a knot tighten in her stomach, regretting the harshness of her words. After a moment, Emily took a deep breath, her expression softening. ""I never knew you felt that way,"" she whispered, breaking the tension that had gripped them moments before.</s>","<|assistant|>Reduced Narrative: Negative, Moderate, Conflict Resolving</s>","<|assistant|>Reduced Narrative: Negative, Moderate, Conflict Resolving</s>","<|assistant|>Reduced Narrative: Negative, Moderate, Conflict Resolving</s>"
"<s><|user|>Reduce Narrative (sentiment, pacing, plotting): Maya sat on the bench in the park, her eyes fixed on the colorful leaves fluttering down from the trees. Next to her, Jake lay sprawled out on the grass, his laughter filling the crisp fall air. They had been friends since childhood, but lately, things had felt different. As they watched a group of kids playing tag, Maya finally turned to Jake, her heart pounding with nervousness.</s>","<|assistant|>Reduced Narrative: Positive, Moderate, Conflict Resolving</s>","<|assistant|>Reduced Narrative: Positive, Moderate, Conflict Resolving</s>","<|assistant|>Reduced Narrative: Positive, Moderate, Conflict Resolving</s>"
"<s><|user|>Reduce Narrative (sentiment, pacing, plotting): The bright sun slowly dipped below the horizon, casting a warm glow over the small town. As the day came to a close, a young man stood on the edge of a cliff, letting the gentle breeze rustle his hair. Memories of the past flooded his mind, but there was a sense of peace in the air.</s>","<|assistant|>Reduced Narrative: Neutral, Fast, Conflict Resolving</s>","<|assistant|>Reduced Narrative: Neutral, Fast, Conflict Resolving</s>","<|assistant|>Reduced Narrative: Neutral, Fast, Conflict Resolving</s>"
"<s><|user|>Reduce Narrative (sentiment, pacing, plotting): As the storm clouds gathered ominously in the darkening sky, Sarah and Luke stood facing each other, their voices barely above a whisper. ""I can't do this anymore, Luke,"" Sarah's words quivered with unshed tears. Luke reached out a trembling hand, his eyes betraying the pain he felt. ""I know, Sarah. I never meant for things to end up like this.""</s>","<|assistant|>Reduced Narrative: Negative, Slow, Conflict Resolving</s>","<|assistant|>Reduced Narrative: Negative, Slow, Conflict Resolving</s>","<|assistant|>Reduced Narrative: Negative, Slow, Conflict Resolving</s>"
"<s><|user|>Reduce Narrative (sentiment, pacing, plotting): Sarah stood in the kitchen, a warm breeze flowing through the open window. She carefully stirred the pot of soup on the stove, a smile playing on her lips. The aroma of herbs and vegetables filled the room, a comforting scent that reminded her of lazy weekends spent cooking with her grandmother. As the soup simmered, Sarah thought back to the argument she had with her best friend yesterday. They had exchanged harsh words, both feeling hurt and misunderstood. But today, Sarah decided it was time to mend their friendship. She picked up the phone, took a deep breath, and dialed her friend's number.</s>","<|assistant|>Reduced Narrative: Positive, Moderate, Conflict Resolving</s>","<|assistant|>Reduced Narrative: Positive, Moderate, Conflict Resolving</s>","<|assistant|>Reduced Narrative: Positive, Moderate, Conflict Resolving</s>"
"<s><|user|>Reduce Narrative (sentiment, pacing, plotting): As they walked through the sun-dappled forest, the long-forgotten memories started to resurface. The crunch of leaves under their feet echoed through the silent woods, a sound that seemed both comforting and haunting. The old oak tree, standing tall and proud, served as a silent witness to their shared past. Finally, as they reached the calm river flowing gently nearby, they both realized it was time to confront the truth that had kept them apart for so long.</s>","<|assistant|>Reduced Narrative: Neutral, Slow, Conflict Resolving</s>","<|assistant|>Reduced Narrative: Neutral, Slow, Conflict Resolving</s>","<|assistant|>Reduced Narrative: Neutral, Slow, Conflict Resolving</s>"
"<s><|user|>Reduce Narrative (sentiment, pacing, plotting): Sarah gazed out into the vast ocean, the gentle sound of waves breaking against the shore filling her ears. The sun was setting, painting the sky in a hue of orange and pink, casting a soft glow over everything. She couldn't help but feel a sense of melancholy creeping in, a longing for something she couldn't quite grasp.</s>","<|assistant|>Reduced Narrative: Neutral, Slow, Conflict Rising</s>","<|assistant|>Reduced Narrative: Neutral, Slow, Conflict Rising</s>","<|assistant|>Reduced Narrative: Neutral, Slow, Conflict Rising</s>"
"<s><|user|>Reduce Narrative (sentiment, pacing, plotting): In the misty forest, the old oak tree swayed gently in the breeze, its leaves whispering secrets of ancient times. A young wanderer, hood pulled tight against the chill, stepped cautiously on the moss-covered trail. His eyes searched the shadows as a distant howl pierced the stillness, sending shivers down his spine. The path ahead was uncertain, but the flicker of bravery in his heart pushed him forward into the unknown.</s>","<|assistant|>Reduced Narrative: Positive, Slow, Conflict Rising</s>","<|assistant|>Reduced Narrative: Positive, Slow, Conflict Rising</s>","<|assistant|>Reduced Narrative: Positive, Slow, Conflict Rising</s>"
"<s><|user|>Reduce Narrative (sentiment, pacing, plotting): Amidst the bustling city streets, Sarah's heart raced as she dashed towards the airport gate, her flight about to depart. As she reached the security checkpoint, she realized her passport was missing, panic setting in.</s>","<|assistant|>Reduced Narrative: Positive, Fast, Conflict Rising</s>","<|assistant|>Reduced Narrative: Positive, Fast, Conflict Rising</s>","<|assistant|>Reduced Narrative: Positive, Fast, Conflict Rising</s>"
"<s><|user|>Reduce Narrative (sentiment, pacing, plotting): As the storm clouds gathered ominously in the sky, tension simmered between the two old friends. Emily's jaw tightened, her eyes flashing with suppressed anger. David tried to break the icy silence that had settled between them, but his words seemed to only fuel the growing resentment. The air crackled with unspoken words, the calm before the storm that was about to engulf their once unbreakable bond.</s>","<|assistant|>Reduced Narrative: Negative, Slow, Conflict Rising</s>","<|assistant|>Reduced Narrative: Negative, Slow, Conflict Rising</s>","<|assistant|>Reduced Narrative: Negative, Slow, Conflict Rising</s>"
"<s><|user|>Reduce Narrative (sentiment, pacing, plotting): Lily raced through the bustling streets, her heart pounding with excitement. She had just discovered a hidden clue that could lead to the legendary treasure she had been searching for all her life. As she turned a corner, she collided with a mysterious figure, sending them both tumbling to the ground.</s>","<|assistant|>Reduced Narrative: Positive, Fast, Conflict Rising</s>","<|assistant|>Reduced Narrative: Positive, Fast, Conflict Rising</s>","<|assistant|>Reduced Narrative: Positive, Fast, Conflict Rising</s>"
"<s><|user|>Reduce Narrative (sentiment, pacing, plotting): The heavy rain poured relentlessly outside, mirroring the turmoil inside Sarah's heart. She had always believed in second chances, but each time she looked at him, the wounds of deceit reopened. His apology seemed hollow, and she struggled with the choice between forgiveness and self-preservation.</s>","<|assistant|>Reduced Narrative: Negative, Slow, Conflict Rising</s>","<|assistant|>Reduced Narrative: Negative, Slow, Conflict Rising</s>","<|assistant|>Reduced Narrative: Negative, Slow, Conflict Rising</s>"
"<s><|user|>Reduce Narrative (sentiment, pacing, plotting): As the sun began to set behind the mountains, Sarah and David sat on the porch swing, sipping hot cocoa in comfortable silence. The tension that had lingered between them for weeks seemed to dissolve with each passing moment, as they watched the colors of the sky change from vibrant orange to soft shades of pink and purple. Sarah finally broke the silence, her voice filled with warmth and understanding, ""I'm sorry for what I said before. I never meant to hurt you."" David smiled, his eyes reflecting the fading light, ""I know, and I'm sorry too. Let's leave it all behind us and start anew, okay?"" They reached for each other's hands, a silent promise of forgiveness and a fresh beginning.</s>","<|assistant|>Reduced Narrative: Positive, Slow, Conflict Resolving</s>","<|assistant|>Reduced Narrative: Positive, Slow, Conflict Resolving</s>","<|assistant|>Reduced Narrative: Positive, Slow, Conflict Resolving</s>"
"<s><|user|>Reduce Narrative (sentiment, pacing, plotting): As the sun set behind the jagged peaks, casting a golden hue over the serene meadow, Sarah and Ethan sat on a weathered wooden bench, their silence speaking volumes. Sarah twirled a daisy absentmindedly between her fingers, while Ethan stared off into the distance, his brow furrowed in deep thought. The gentle rustle of leaves in the breeze was the only sound between them, a stark contrast to the turmoil brewing within.</s>","<|assistant|>Reduced Narrative: Neutral, Slow, Conflict Rising</s>","<|assistant|>Reduced Narrative: Neutral, Slow, Conflict Rising</s>","<|assistant|>Reduced Narrative: Neutral, Slow, Conflict Rising</s>"
"<s><|user|>Reduce Narrative (sentiment, pacing, plotting): Sarah walked along the cobbled streets, the afternoon sun warming her face. She stopped in front of a quaint bookstore that she hadn't noticed before. Curious, she pushed the door open and was greeted by the soft scent of old books and a gentle hum of a classical melody playing in the background. As she browsed the shelves, her fingers trailing over worn spines, she felt a sense of peace wash over her, leaving behind the worries that had burdened her for weeks.</s>","<|assistant|>Reduced Narrative: Neutral, Slow, Conflict Resolving</s>","<|assistant|>Reduced Narrative: Neutral, Slow, Conflict Resolving</s>","<|assistant|>Reduced Narrative: Neutral, Slow, Conflict Resolving</s>"
"<s><|user|>Reduce Narrative (sentiment, pacing, plotting): As the sun dipped below the horizon, casting hues of orange and pink across the sky, Emily strolled along the cobbled path, the faint scent of lilacs hanging in the air. She couldn't shake off the unease gnawing at her, a sense that things were about to change in ways she couldn't foresee. Each step felt heavier, burdened with the weight of the unknown.</s>","<|assistant|>Reduced Narrative: Positive, Slow, Conflict Rising</s>","<|assistant|>Reduced Narrative: Positive, Slow, Conflict Rising</s>","<|assistant|>Reduced Narrative: Positive, Slow, Conflict Rising</s>"
"<s><|user|>Reduce Narrative (sentiment, pacing, plotting): In the quiet town of Willow Creek, whispers filled the air like the gentle rustling of leaves in the wind. Sarah stood by the old oak tree, watching as her best friend, Emily, walked hand in hand with the newcomer, Ethan. A sense of unease crept over Sarah as she noticed the way Emily's laughter seemed a little too bright, a little too forced.</s>","<|assistant|>Reduced Narrative: Neutral, Slow, Conflict Rising</s>","<|assistant|>Reduced Narrative: Neutral, Slow, Conflict Rising</s>","<|assistant|>Reduced Narrative: Neutral, Slow, Conflict Rising</s>"
"<s><|user|>Reduce Narrative (sentiment, pacing, plotting): Sarah and David stood face to face, the tension crackling between them like electricity. After months of misunderstandings and arguments, they both took a deep breath, ready to finally lay their conflicts to rest.</s>","<|assistant|>Reduced Narrative: Neutral, Fast, Conflict Resolving</s>","<|assistant|>Reduced Narrative: Neutral, Fast, Conflict Resolving</s>","<|assistant|>Reduced Narrative: Neutral, Fast, Conflict Resolving</s>"
"<s><|user|>Reduce Narrative (sentiment, pacing, plotting): Lightning crackled across the sky as Mara sprinted through the dark, narrow alleyways of the city. Her breath came in sharp gasps, the cold air biting at her lungs. Behind her, the sound of heavy boots thudding against the cobblestones grew louder, a relentless reminder of the danger on her tail. She risked a glance over her shoulder, catching a glimpse of shadowy figures weaving through the darkness, their intentions as ominous as the storm overhead. With a burst of adrenaline, Mara pushed herself harder, knowing that her life depended on the speed of her legs and the quickness of her wits.</s>","<|assistant|>Reduced Narrative: Negative, Fast, Conflict Rising</s>","<|assistant|>Reduced Narrative: Negative, Fast, Conflict Rising</s>","<|assistant|>Reduced Narrative: Negative, Fast, Conflict Rising</s>"
