text,text,label,target
"<s><|user|>Reduce Narrative (sentiment, pacing, plotting): The sun was setting over the vast plains, casting a warm orange hue over the horizon as Sarah and Alex sat down by the campfire. The crackling flames danced to an unknown rhythm, mirroring the quiet laughter between the two friends. They had been on the road for weeks, facing challenges and uncertainties, but in that moment, surrounded by nature's calming embrace, they both knew they found a sense of home within each other's company. As the night unfolded its starry blanket over them, Sarah and Alex shared stories of their past, dreams of the future, and in that bond forged by firelight, they discovered a strength that nothing could shatter.</s>","<|assistant|>Reduced Narrative: Positive, Moderate, Conflict Resolving</s>","<|assistant|>Reduced Narrative: Positive, Moderate, Conflict Resolving</s>","<|assistant|>Reduced Narrative: Positive, Moderate, Conflict Resolving</s>"
"<s><|user|>Reduce Narrative (sentiment, pacing, plotting): The storm clouds loomed menacingly in the sky, casting a dark shadow over the once sunny meadow. The wind howled, bending the trees nearly in half as lightning crackled ominously in the distance. Panic spread among the villagers as they scrambled to secure their homes and livestock before disaster struck. In the midst of the chaos, a lone figure emerged, clad in a worn cloak and carrying a staff that shimmered with ancient power.</s>","<|assistant|>Reduced Narrative: Negative, Fast, Conflict Resolving</s>","<|assistant|>Reduced Narrative: Negative, Fast, Conflict Resolving</s>","<|assistant|>Reduced Narrative: Negative, Fast, Conflict Resolving</s>"
"<s><|user|>Reduce Narrative (sentiment, pacing, plotting): The storm clouds gathered ominously on the horizon, casting long shadows over the peaceful village below. The townsfolk hurriedly boarded up windows and secured their belongings, whispering fearful tales of the approaching tempest.</s>","<|assistant|>Reduced Narrative: Negative, Slow, Conflict Rising</s>","<|assistant|>Reduced Narrative: Negative, Slow, Conflict Rising</s>","<|assistant|>Reduced Narrative: Negative, Slow, Conflict Rising</s>"
"<s><|user|>Reduce Narrative (sentiment, pacing, plotting): As the sun set behind the rugged mountains, Sarah and James sat by the crackling campfire, the flames casting a warm glow on their faces. They had been friends for years, but tonight felt different. James reached for Sarah's hand, and she looked into his eyes, seeing a mix of nervousness and longing. Without a word, he brought her hand to his lips, planting a soft kiss on her skin. In that moment, time seemed to stand still as they both realized the depth of their feelings for each other.</s>","<|assistant|>Reduced Narrative: Positive, Slow, Conflict Resolving</s>","<|assistant|>Reduced Narrative: Positive, Slow, Conflict Resolving</s>","<|assistant|>Reduced Narrative: Positive, Slow, Conflict Resolving</s>"
"<s><|user|>Reduce Narrative (sentiment, pacing, plotting): Sarah stood at the edge of the cliff, the wind tugging at her hair. She glanced back, seeing her friends cheering her on. With a deep breath, she took the leap, feeling the rush of freedom as she soared through the air, overcome with exhilaration at overcoming her fear of heights.</s>","<|assistant|>Reduced Narrative: Positive, Moderate, Conflict Resolving</s>","<|assistant|>Reduced Narrative: Positive, Moderate, Conflict Resolving</s>","<|assistant|>Reduced Narrative: Positive, Moderate, Conflict Resolving</s>"
"<s><|user|>Reduce Narrative (sentiment, pacing, plotting): Sarah stormed into the office, her eyes blazing with anger as she confronted her colleague about the stolen idea presented in the meeting earlier that day. Voices raised, tensions surged higher, creating a palpable air of conflict in the once serene workplace.</s>","<|assistant|>Reduced Narrative: Negative, Fast, Conflict Rising</s>","<|assistant|>Reduced Narrative: Negative, Fast, Conflict Rising</s>","<|assistant|>Reduced Narrative: Negative, Fast, Conflict Rising</s>"
"<s><|user|>Reduce Narrative (sentiment, pacing, plotting): As the sun dipped below the horizon, casting a warm glow over the quiet meadow, Sarah and Mark sat on the old wooden swing, gently swaying back and forth. The tension that had simmered between them for weeks seemed to dissipate with each passing moment. Mark reached out, taking Sarah's hand in his, a reassuring smile spreading across his face. In that serene moment, the weight of misunderstandings and hurtful words faded away, replaced by a newfound sense of understanding and forgiveness.</s>","<|assistant|>Reduced Narrative: Positive, Slow, Conflict Resolving</s>","<|assistant|>Reduced Narrative: Positive, Slow, Conflict Resolving</s>","<|assistant|>Reduced Narrative: Positive, Slow, Conflict Resolving</s>"
"<s><|user|>Reduce Narrative (sentiment, pacing, plotting): The door burst open, revealing a figure silhouetted against the setting sun. ""I found it!"" the words tumbled out, carrying a sense of urgency that captured everyone's attention. Excitement rippled through the room, faces lighting up as the long-searched-for solution seemed within reach.</s>","<|assistant|>Reduced Narrative: Positive, Fast, Conflict Rising</s>","<|assistant|>Reduced Narrative: Positive, Fast, Conflict Rising</s>","<|assistant|>Reduced Narrative: Positive, Fast, Conflict Rising</s>"
"<s><|user|>Reduce Narrative (sentiment, pacing, plotting): The loud roar of the engines filled the air as the racecars sped around the track, each driver intensely focused on gaining the lead. As they approached a sharp turn, one car swerved, causing a chain reaction of chaos behind it. The crowd gasped as tires screeched and metal scraped against metal, creating a symphony of chaos on the racetrack.</s>","<|assistant|>Reduced Narrative: Neutral, Fast, Conflict Rising</s>","<|assistant|>Reduced Narrative: Neutral, Fast, Conflict Rising</s>","<|assistant|>Reduced Narrative: Neutral, Fast, Conflict Rising</s>"
"<s><|user|>Reduce Narrative (sentiment, pacing, plotting): As the sun painted the sky in hues of pink and gold, Olivia stood at the edge of the cliff, taking in the breathtaking view of the vast ocean below. She felt a mix of excitement and nervousness flutter in her chest; today, she was determined to conquer her fear of heights by finally taking the leap and paragliding off the cliff.</s>","<|assistant|>Reduced Narrative: Positive, Moderate, Conflict Rising</s>","<|assistant|>Reduced Narrative: Positive, Moderate, Conflict Rising</s>","<|assistant|>Reduced Narrative: Positive, Moderate, Conflict Rising</s>"
"<s><|user|>Reduce Narrative (sentiment, pacing, plotting): As the sun dipped below the horizon, Emily's heart raced with a mix of excitement and nerves. She stood on the edge of the cliff, the wind tangling her hair, the distant waves crashing against the rocks below. With a deep breath, she took a step forward, ready to take the leap of faith into the unknown.</s>","<|assistant|>Reduced Narrative: Positive, Fast, Conflict Rising</s>","<|assistant|>Reduced Narrative: Positive, Fast, Conflict Rising</s>","<|assistant|>Reduced Narrative: Positive, Fast, Conflict Rising</s>"
"<s><|user|>Reduce Narrative (sentiment, pacing, plotting): Sarah and Tom sat across from each other at the cozy cafe, the tension that had been lingering between them finally dissipating with each shared smile and heartfelt apology. They clinked their coffee mugs together, a silent agreement to move forward and leave the misunderstanding behind them.</s>","<|assistant|>Reduced Narrative: Positive, Fast, Conflict Resolving</s>","<|assistant|>Reduced Narrative: Positive, Fast, Conflict Resolving</s>","<|assistant|>Reduced Narrative: Positive, Fast, Conflict Resolving</s>"
"<s><|user|>Reduce Narrative (sentiment, pacing, plotting): The storm clouds gathered ominously overhead as Sarah hurried through the unfamiliar woods, clutching a worn map that seemed to provide more confusion than guidance. The sound of an approaching howl made her heart race, the eerie cry freezing her steps. She was lost, pursued by unseen dangers, her only ally the determined beat of rain hitting the leaves above.</s>","<|assistant|>Reduced Narrative: Neutral, Fast, Conflict Rising</s>","<|assistant|>Reduced Narrative: Neutral, Fast, Conflict Rising</s>","<|assistant|>Reduced Narrative: Neutral, Fast, Conflict Rising</s>"
"<s><|user|>Reduce Narrative (sentiment, pacing, plotting): Sarah nervously entered the room, her hands trembling as she carried a tray of steaming tea cups. She was about to confront her long-time friend, Emily, about a hurtful secret she had discovered. As Emily turned to face Sarah, a tension hung in the air, waiting to shatter the bond that had once been unbreakable.</s>","<|assistant|>Reduced Narrative: Positive, Moderate, Conflict Rising</s>","<|assistant|>Reduced Narrative: Positive, Moderate, Conflict Rising</s>","<|assistant|>Reduced Narrative: Positive, Moderate, Conflict Rising</s>"
"<s><|user|>Reduce Narrative (sentiment, pacing, plotting): Sarah stood on the edge of the cliff, the wind tousling her hair as she gazed out at the vast ocean stretching endlessly before her. Memories flooded her mind, both happy and painful, intertwining like the waves crashing against the rocks below. She couldn't escape the looming decision she had to make, one that would alter the course of her life forever.</s>","<|assistant|>Reduced Narrative: Neutral, Slow, Conflict Rising</s>","<|assistant|>Reduced Narrative: Neutral, Slow, Conflict Rising</s>","<|assistant|>Reduced Narrative: Neutral, Slow, Conflict Rising</s>"
"<s><|user|>Reduce Narrative (sentiment, pacing, plotting): As the sun dipped below the horizon, Sarah wandered through the tranquil garden, the scent of blooming jasmine filling the air. She was surrounded by the soft rustling of the leaves and the distant chirping of crickets. Lost in her thoughts, she traced the winding path, the moonlight casting a silvery glow on the delicate petals of the flowers.</s>","<|assistant|>Reduced Narrative: Positive, Slow, Conflict Rising</s>","<|assistant|>Reduced Narrative: Positive, Slow, Conflict Rising</s>","<|assistant|>Reduced Narrative: Positive, Slow, Conflict Rising</s>"
"<s><|user|>Reduce Narrative (sentiment, pacing, plotting): Sarah sat on the porch swing, gently swaying back and forth as she watched the sun dip below the horizon. The cool evening breeze brushed against her skin, carrying with it the scent of freshly mown grass. It was one of those rare moments of tranquility amidst the chaos of daily life.</s>","<|assistant|>Reduced Narrative: Neutral, Slow, Conflict Resolving</s>","<|assistant|>Reduced Narrative: Neutral, Slow, Conflict Resolving</s>","<|assistant|>Reduced Narrative: Neutral, Slow, Conflict Resolving</s>"
"<s><|user|>Reduce Narrative (sentiment, pacing, plotting): As the storm raged outside, Sarah faced her husband, her eyes brimming with tears. ""I can't do this anymore, Mark. I'm leaving."" With those words hanging heavily in the air, she swiftly packed a bag, determined to finally break free from the toxic cycle of their relationship.</s>","<|assistant|>Reduced Narrative: Negative, Fast, Conflict Resolving</s>","<|assistant|>Reduced Narrative: Negative, Fast, Conflict Resolving</s>","<|assistant|>Reduced Narrative: Negative, Fast, Conflict Resolving</s>"
"<s><|user|>Reduce Narrative (sentiment, pacing, plotting): As the sun dipped below the horizon, casting hues of orange and pink over the tranquil meadow, Ella and Oliver sat side by side on a weathered wooden bench. The air was filled with the gentle chirping of crickets and the soft rustling of leaves in the breeze, creating a serene ambiance that enveloped them in a comforting embrace. Ella turned to Oliver, her eyes reflecting a sense of contentment that had eluded her for so long. With a smile that lit up her whole face, she whispered, ""Thank you for being by my side through it all.""</s>","<|assistant|>Reduced Narrative: Positive, Slow, Conflict Resolving</s>","<|assistant|>Reduced Narrative: Positive, Slow, Conflict Resolving</s>","<|assistant|>Reduced Narrative: Positive, Slow, Conflict Resolving</s>"
"<s><|user|>Reduce Narrative (sentiment, pacing, plotting): Sarah hurried through the forest, the branches whispering secrets as she passed. Her heart raced with the anticipation of what lay ahead. The sun was setting, casting long shadows across her path. Suddenly, she heard a rustle behind her, causing her to quicken her pace even more.</s>","<|assistant|>Reduced Narrative: Neutral, Fast, Conflict Rising</s>","<|assistant|>Reduced Narrative: Neutral, Fast, Conflict Rising</s>","<|assistant|>Reduced Narrative: Neutral, Fast, Conflict Rising</s>"
"<s><|user|>Reduce Narrative (sentiment, pacing, plotting): Sarah's heart raced as she sprinted through the woods, the sound of branches snapping behind her. She stumbled but forced herself to keep going; her goal was just ahead. The adrenaline pumping through her veins drowned out the fear, pushing her to run faster than she thought possible. Finally, she burst into the clearing, her breath ragged as she faced the looming figure blocking her path.</s>","<|assistant|>Reduced Narrative: Positive, Fast, Conflict Rising</s>","<|assistant|>Reduced Narrative: Positive, Fast, Conflict Rising</s>","<|assistant|>Reduced Narrative: Positive, Fast, Conflict Rising</s>"
"<s><|user|>Reduce Narrative (sentiment, pacing, plotting): Sarah rushed to the hospital, her heart pounding with a mix of nervousness and excitement. She was about to meet her newborn baby sister for the first time. As she stepped into the room, she saw her parents beaming with joy, cradling the tiny bundle of life in their arms. In that moment, any lingering doubts or fears vanished, replaced by a profound sense of love and warmth.</s>","<|assistant|>Reduced Narrative: Positive, Fast, Conflict Resolving</s>","<|assistant|>Reduced Narrative: Positive, Fast, Conflict Resolving</s>","<|assistant|>Reduced Narrative: Positive, Fast, Conflict Resolving</s>"
"<s><|user|>Reduce Narrative (sentiment, pacing, plotting): Sarah dashed through the crowded marketplace, her heart pounding with excitement. She clutched the ancient map tightly in her hand, the key to finding the long-lost treasure hidden in the depths of the nearby enchanted forest. Each step she took brought her closer to solving the mysteries that had baffled adventurers for centuries.</s>","<|assistant|>Reduced Narrative: Positive, Fast, Conflict Rising</s>","<|assistant|>Reduced Narrative: Positive, Fast, Conflict Rising</s>","<|assistant|>Reduced Narrative: Positive, Fast, Conflict Rising</s>"
"<s><|user|>Reduce Narrative (sentiment, pacing, plotting): Sarah stormed into the office, her face a mask of determination. She was tired of being overlooked for promotions while others simply climbed the ladder through patronage. Today, she decided, things would change. With a folder of meticulously prepared reports in hand, she headed straight to the boss's office, ready to stake her claim.</s>","<|assistant|>Reduced Narrative: Neutral, Fast, Conflict Rising</s>","<|assistant|>Reduced Narrative: Neutral, Fast, Conflict Rising</s>","<|assistant|>Reduced Narrative: Neutral, Fast, Conflict Rising</s>"
"<s><|user|>Reduce Narrative (sentiment, pacing, plotting): In the quiet town of Willowbrook, the early morning fog draped over the meadows like a soft, misty blanket. Emma stood at the edge of the forest, her eyes scanning the dense trees for any signs of movement. She could sense an unease in the air, as if the very nature around her held its breath, waiting for something unknown to unfold.</s>","<|assistant|>Reduced Narrative: Positive, Slow, Conflict Rising</s>","<|assistant|>Reduced Narrative: Positive, Slow, Conflict Rising</s>","<|assistant|>Reduced Narrative: Positive, Slow, Conflict Rising</s>"
"<s><|user|>Reduce Narrative (sentiment, pacing, plotting): In the heart of the forest, the tranquility was disrupted by a sudden rustling of leaves. A young explorer, Liam, cautiously peered around, trying to pinpoint the source of the disturbance. As he crept closer, the faint sound of whimpering reached his ears, pulling him deeper into the thick vegetation. With each step, the tension in the air grew palpable, hinting at an unknown challenge awaiting Liam in the shadows.</s>","<|assistant|>Reduced Narrative: Neutral, Moderate, Conflict Rising</s>","<|assistant|>Reduced Narrative: Neutral, Moderate, Conflict Rising</s>","<|assistant|>Reduced Narrative: Neutral, Moderate, Conflict Rising</s>"
"<s><|user|>Reduce Narrative (sentiment, pacing, plotting): Jenny could feel her heart sinking as she read the email from her boss. Her project, which she had poured endless hours into, was being reassigned to a colleague. She felt a surge of frustration and disappointment wash over her, knowing that this decision would not only impact her work but also her reputation within the team.</s>","<|assistant|>Reduced Narrative: Negative, Moderate, Conflict Rising</s>","<|assistant|>Reduced Narrative: Negative, Moderate, Conflict Rising</s>","<|assistant|>Reduced Narrative: Negative, Moderate, Conflict Rising</s>"
"<s><|user|>Reduce Narrative (sentiment, pacing, plotting): Sarah stood at the edge of the cliff, the wind tugging at her hair, staring at the vast expanse of the ocean below. Memories flooded her mind - the laughter, the tears, the shared dreams now shattered. She took a deep breath, closed her eyes, and let go of the anger and resentment that had consumed her for so long. Opening her eyes, she felt a sense of calm wash over her as she whispered, ""I forgive you.""</s>","<|assistant|>Reduced Narrative: Neutral, Fast, Conflict Resolving</s>","<|assistant|>Reduced Narrative: Neutral, Fast, Conflict Resolving</s>","<|assistant|>Reduced Narrative: Neutral, Fast, Conflict Resolving</s>"
"<s><|user|>Reduce Narrative (sentiment, pacing, plotting): Sarah's heart raced as she read the letter in her hand. The words on the page confirmed her suspicions about her best friend's betrayal. Tears welled up in her eyes, mixing with a fierce determination. She knew she had to confront Emma, but how could she face the person who had been like a sister to her for years?</s>","<|assistant|>Reduced Narrative: Positive, Moderate, Conflict Rising</s>","<|assistant|>Reduced Narrative: Positive, Moderate, Conflict Rising</s>","<|assistant|>Reduced Narrative: Positive, Moderate, Conflict Rising</s>"
"<s><|user|>Reduce Narrative (sentiment, pacing, plotting): As the sun dipped below the horizon, casting a warm amber glow over the rolling hills, Sarah found herself standing at the edge of a cliff. The wind gently tousled her hair, carrying the scent of freshly-cut grass. Below, the river sparkled like a ribbon of silver in the fading light. A sense of uncertainty gripped her heart as she contemplated the vast expanse before her.</s>","<|assistant|>Reduced Narrative: Neutral, Slow, Conflict Rising</s>","<|assistant|>Reduced Narrative: Neutral, Slow, Conflict Rising</s>","<|assistant|>Reduced Narrative: Neutral, Slow, Conflict Rising</s>"
"<s><|user|>Reduce Narrative (sentiment, pacing, plotting): As the sun began to set, casting a warm glow over the vast meadow, Jake stood at the edge, watching the tall grass dance in the gentle breeze. His thoughts wandered to the growing tension among his friends on this camping trip. Unspoken words hung heavy in the air, hinting at underlying conflicts that threatened to shatter their bond. Despite the picturesque surroundings, a storm brewed within the group, waiting to break free.</s>","<|assistant|>Reduced Narrative: Neutral, Moderate, Conflict Rising</s>","<|assistant|>Reduced Narrative: Neutral, Moderate, Conflict Rising</s>","<|assistant|>Reduced Narrative: Neutral, Moderate, Conflict Rising</s>"
"<s><|user|>Reduce Narrative (sentiment, pacing, plotting): Sarah took a deep breath as she entered the meeting room, ready to address the ongoing project issues with her team. She started by highlighting the progress made so far and then gently guided the conversation towards finding solutions rather than blaming individuals. Slowly but steadily, the tension that had been building for weeks started to dissipate as ideas flowed freely, and a sense of teamwork filled the room.</s>","<|assistant|>Reduced Narrative: Positive, Moderate, Conflict Resolving</s>","<|assistant|>Reduced Narrative: Positive, Moderate, Conflict Resolving</s>","<|assistant|>Reduced Narrative: Positive, Moderate, Conflict Resolving</s>"
"<s><|user|>Reduce Narrative (sentiment, pacing, plotting): In the small village of Willowbrook, the annual Harvest Festival was quickly approaching. The excitement in the air was palpable; families worked together to decorate the town square with colorful banners and lanterns, while the aroma of freshly baked pies wafted through the streets. Everyone seemed busy but content, looking forward to the upcoming festivities that would unite the community once again.</s>","<|assistant|>Reduced Narrative: Neutral, Moderate, Conflict Resolving</s>","<|assistant|>Reduced Narrative: Neutral, Moderate, Conflict Resolving</s>","<|assistant|>Reduced Narrative: Neutral, Moderate, Conflict Resolving</s>"
"<s><|user|>Reduce Narrative (sentiment, pacing, plotting): The storm clouds gathered ominously on the horizon, casting a dark shadow over the small coastal town. The villagers whispered in fear, their voices filled with apprehension about the legends of the ancient sea creature that was said to rise with the tempest. As the wind picked up and the waves grew restless, the sense of impending danger loomed large.</s>","<|assistant|>Reduced Narrative: Negative, Moderate, Conflict Rising</s>","<|assistant|>Reduced Narrative: Negative, Moderate, Conflict Rising</s>","<|assistant|>Reduced Narrative: Negative, Moderate, Conflict Rising</s>"
"<s><|user|>Reduce Narrative (sentiment, pacing, plotting): The sun dipped below the horizon, casting a warm glow across the tranquil lake. Sarah sat on the dock, her feet skimming the water as she gazed out at the reflections of the trees. In the distance, a loon called out, its haunting cry echoing through the still evening air. Sarah closed her eyes, feeling at peace for the first time in weeks. The weight that had been pressing on her heart seemed to lift, carried away by the gentle breeze that rustled the leaves above her head. She knew that healing took time, but in that moment, surrounded by the beauty of nature, she felt a glimmer of hope begin to bloom within her.</s>","<|assistant|>Reduced Narrative: Neutral, Slow, Conflict Resolving</s>","<|assistant|>Reduced Narrative: Neutral, Slow, Conflict Resolving</s>","<|assistant|>Reduced Narrative: Neutral, Slow, Conflict Resolving</s>"
"<s><|user|>Reduce Narrative (sentiment, pacing, plotting): Sarah hastily packed her bag, her heart racing with anticipation. She was about to confront her longtime friend about a misunderstanding that had created a rift between them. As she walked towards their meeting spot, she rehearsed her words, prepared to finally put an end to the confusion.</s>","<|assistant|>Reduced Narrative: Neutral, Fast, Conflict Rising</s>","<|assistant|>Reduced Narrative: Neutral, Fast, Conflict Rising</s>","<|assistant|>Reduced Narrative: Neutral, Fast, Conflict Rising</s>"
"<s><|user|>Reduce Narrative (sentiment, pacing, plotting): Sarah took a deep breath as she stood in front of the old, rundown house. For years, the place had haunted her dreams with memories she wanted to forget. However, today was different. With a determined look in her eyes, she opened the creaky gate and walked towards the front door. As she stepped inside, a wave of nostalgia washed over her, but this time, instead of fear, she felt a sense of calmness and acceptance.</s>","<|assistant|>Reduced Narrative: Positive, Moderate, Conflict Resolving</s>","<|assistant|>Reduced Narrative: Positive, Moderate, Conflict Resolving</s>","<|assistant|>Reduced Narrative: Positive, Moderate, Conflict Resolving</s>"
"<s><|user|>Reduce Narrative (sentiment, pacing, plotting): Sarah burst through the doors of the old library, the ancient books filled with secrets whispering to her as she desperately searched for the hidden scroll that could break the curse on her family.</s>","<|assistant|>Reduced Narrative: Neutral, Fast, Conflict Resolving</s>","<|assistant|>Reduced Narrative: Neutral, Fast, Conflict Resolving</s>","<|assistant|>Reduced Narrative: Neutral, Fast, Conflict Resolving</s>"
"<s><|user|>Reduce Narrative (sentiment, pacing, plotting): The dark shadows whispered ominous secrets as Emma hurried through the deserted alley, her heart pounding with fear. Just as she thought she could finally breathe a sigh of relief, a figure emerged from the murky darkness, blocking her path with a sinister smile.</s>","<|assistant|>Reduced Narrative: Negative, Fast, Conflict Rising</s>","<|assistant|>Reduced Narrative: Negative, Fast, Conflict Rising</s>","<|assistant|>Reduced Narrative: Negative, Fast, Conflict Rising</s>"
"<s><|user|>Reduce Narrative (sentiment, pacing, plotting): Sarah hurried through the bustling streets, clutching a bouquet of vibrant flowers. She weaved through the crowd until she reached the hospital entrance. Rushing to the maternity ward, she saw her best friend, Emily, tear-streaked but radiant, cradling a tiny newborn in her arms. The newborn's wails filled the room, blending with Emily's joyful sobs.</s>","<|assistant|>Reduced Narrative: Positive, Fast, Conflict Resolving</s>","<|assistant|>Reduced Narrative: Positive, Fast, Conflict Resolving</s>","<|assistant|>Reduced Narrative: Positive, Fast, Conflict Resolving</s>"
